BibliographyType,ISBN,Identifier,Author,Title,Journal,Volume,Number,Month,Pages,Year,Address,Note,URL,Booktitle,Chapter,Edition,Series,Editor,Publisher,ReportType,Howpublished,Institution,Organizations,School,Annote,Custom1,Custom2,Custom3,Custom4,Custom5
7,,a37320603,"Котова, О.  А.","ЭФФЕКТИВНОСТЬ ПСИХОТЕРАПИИ В
РЕАБИЛИТАЦИИ ПАЦИЕНТОВ С
ПОСЛЕДСТВИЯМИ СПИНАЛЬНОЙ ТРАВМЫ",Проблемы здоровья и экологии,,1,,89--93,2019,,,https://elibrary.ru/item.asp?id=37320603,,,,,,,,,,,,,,,,,
7,,a36367861,"Кочетова, Е.  В.","ОЦЕНКА ИНДЕКСА КОМОРБИДНОСТИ
CHARLSON, РИСКА ПЕРЕЛОМОВ FRAX И
СУММАРНОГО СЕРДЕЧНО-СОСУДИСТОГО
РИСКА ПО ШКАЛЕ SCORE У БОЛЬНЫХ
ХОБЛ СО СНИЖЕННЫМ ПИТАТЕЛЬНЫМ
СТАТУСОМ",Современные проблемы науки и образования,,5,,73,2018,,,https://elibrary.ru/item.asp?id=36367861,,,,,,,,,,,,,,,,,
7,,a35352225,"Кошарный, В.  В.; Павлов, А.  И.; Козлов, С.  В.","МЕТОДЫ ДИАГНОСТИКИ ПРИ
ЧЕРЕПНО-МОЗГОВОЙ ТРАВМЕ",Морфологiя,10,3,,361--366,2016,,,https://elibrary.ru/item.asp?id=35352225,,,,,,,,,,,,,,,,,
7,,a37101513,"Кравцов, М.  Н.; Мирзаметов, С.  Д.; Свистов, Д.  В.","МЕТОДИКИ АУГМЕНТАЦИИ И
ПЕРКУТАННОЙ ВИДЕОЭНДОСКОПИЧЕСКОЙ
ДЕКОМПРЕССИИ В ЛЕЧЕНИИ ПАЦИЕНТОВ С
ОСТЕОПОРОТИЧЕСКИМИ ПЕРЕЛОМАМИ
ПОЗВОНКОВ",Саратовский научно-медицинский журнал,14,3,,412--416,2018,,,https://elibrary.ru/item.asp?id=37101513,,,,,,,,,,,,,,,,,
7,,a35670452,"Крамарев, С.  А.; Закордонец, Л.  В.","АНТИБАКТЕРИАЛЬНАЯ ТЕРАПИЯОСТРОГО
НЕОСЛОЖНЕННОГО ЦИСТИТА",Актуальная инфектология,6,4,,185--188,2018,,,https://elibrary.ru/item.asp?id=35670452,,,,,,,,,,,,,,,,,
7,,a36265285,"Красносельский, Н.  В.; Белый, А.  Н.","ПРИНЦИПЫ МИНИМИЗАЦИИ
ХИРУРГИЧЕСКОЙ ТРАВМЫ ПРИ РАКЕ
ГРУДНОЙ ЖЕЛЕЗЫ И ВОЗМОЖНОСТИ
РЕКОНСТРУКЦИИ",Український радіологічний журнал,26,2,,99--101,2018,,,https://elibrary.ru/item.asp?id=36265285,,,,,,,,,,,,,,,,,
7,,a35448060,"Красюков, А.  В.; Машковский, Е.  В.; Ачкасов, Е.  Е.; Кащенко, Е.  М.","НАРУШЕНИЯ РАБОТЫ
СЕРДЕЧНО-СОСУДИСТОЙ СИСТЕМЫ У
ЛЮДЕЙ С ХРОНИЧЕСКОЙ ТРАВМОЙ
СПИННОГО МОЗГА ПРИ ЗАНЯТИЯХ
АДАПТИВНОЙ ФИЗИЧЕСКОЙ КУЛЬТУРОЙ И
ПАРАЛИМПИЙСКИМ СПОРТОМ",Вестник Российской академии медицинских наук,73,4,,236--243,2018,,,https://elibrary.ru/item.asp?id=35448060,,,,,,,,,,,,,,,,,
7,,a37051909,"Кривопалов, А.  А.; Шамкина, П.  А.; Брайко, И.  И.","МЕТОД ЭНДОЭКСТРАЛАРИНГЕАЛЬНОЙ
ЛАТЕРОФИКСАЦИИ ГОЛОСОВЫХ СКЛАДОК В
ЛЕЧЕНИИ ХРОНИЧЕСКИХ ПАРАЛИТИЧЕСКИХ
СТЕНОЗОВ ГОРТАНИ",Российская оториноларингология,18,1,,64--69,2019,,,https://elibrary.ru/item.asp?id=37051909,,,,,,,,,,,,,,,,,
7,,a36346837,"Кубрак, Н.  В.; Краснов, В.  В.","КЛИНИЧЕСКАЯ ОЦЕНКА СПОНТАННОГО
ВОССТАНОВЛЕНИЯ ФУНКЦИЙ ТАЗОВЫХ
КОНЕЧНОСТЕЙ У КРЫС ПОСЛЕ
КОНТУЗИОННОЙ ТРАВМЫ СПИННОГО МОЗГА
СРЕДНЕЙ СТЕПЕНИ ТЯЖЕСТИ",Ветеринария,,11,,47--52,2018,,,https://elibrary.ru/item.asp?id=36346837,,,,,,,,,,,,,,,,,
7,,a36401259,"Кудяшев, А.  Л.; Хоминец, В.  В.; Теремшонок, А.  В.; Коростелев, К.  Е.; Нагорный, Е.  Б.; Доль, А.  В.; Иванов, Д.  В.; Кириллова, И.  В.; Коссович, Л.  Ю.","БИОМЕХАНИЧЕСКИЕ ПРЕДПОСЫЛКИ
ФОРМИРОВАНИЯ ПРОКСИМАЛЬНОГО
ПЕРЕХОДНОГО КИФОЗА ПОСЛЕ
ТРАНСПЕДИКУЛЯРНОЙ ФИКСАЦИИ
ПОЯСНИЧНОГО ОТДЕЛА ПОЗВОНОЧНИКА",Российский журнал биомеханики,21,3,,313--323,2017,,,https://elibrary.ru/item.asp?id=36401259,,,,,,,,,,,,,,,,,
7,,a36807254,"Кузнецов, С.  Б.; Корель, А.  В.","ИСПОЛЬЗОВАНИЕ СТВОЛОВЫХ КЛЕТОК В
ЛЕЧЕНИИ ТРАВМ СПИННОГО МОЗГА",Международный журнал прикладных и фундаментальных исследований,,12,,155--164,2018,,,https://elibrary.ru/item.asp?id=36807254,,,,,,,,,,,,,,,,,
7,,a37254721,"Кулага, А.  В.; Мусаев, Э.  Р.; Жукова, Л.  Г.; Валиев, А.  К.; Борзов, К.  А.; Кабардаев, Р.  М.; Софронов, Д.  И.; Степанова, А.  М.; Абдулжалиев, А.  Т.","ЛОКАЛЬНОЕ ЛЕЧЕНИЕ ПАЦИЕНТОВ С
МЕТАСТАТИЧЕСКИМ ПОРАЖЕНИЕМ
ПОЗВОНОЧНИКА ПРИ РАКЕ ЛЕГКОГО","Саркомы костей, мягких тканей и опухоли кожи",11,1,,5--14,2019,,,https://elibrary.ru/item.asp?id=37254721,,,,,,,,,,,,,,,,,
7,,a36540966,"Кулакеев, O.  K.; Медетбеков, Т.  А.; Есенбеков, М.  У.; Жаркынбаев, А.  Ж.; Тастанбеков, С.  К.","РЕЗУЛЬТАТЫ ЛЕЧЕНИЯ ТРАВМ ГРУДИ В
УСЛОВИЯХ ГОРОДСКОЙ БОЛЬНИЦЫ",Фармация Казахстана,,2,,37--40,2017,,,https://elibrary.ru/item.asp?id=36540966,,,,,,,,,,,,,,,,,
7,,a37308820,"Кулешов, А.  А.; Шкарубо, А.  Н.; Еськин, Н.  А.; Ветрилэ, М.  С.; Лисянский, И.  Н.; Макаров, С.  Н.; Пономаренко, Г.  П.; Чернов, И.  В.","ВАРИАНТЫ ХИРУРГИЧЕСКОГО ЛЕЧЕНИЯ
ЗАСТАРЕЛЫХ ПЕРЕЛОМОВ ЗУБОВИДНОГО
ОТРОСТКА С2 ПОЗВОНКА",Хирургия позвоночника,16,1,,16--24,2019,,,https://elibrary.ru/item.asp?id=37308820,,,,,,,,,,,,,,,,,
7,,a37164609,"Купина, Е.  С.; Дебердеев, И.  Р.","ТАКТИКА ХИРУРГИЧЕСКОГО ЛЕЧЕНИЯ
ПРИ МНОЖЕСТВЕННЫХ И МНОГОУРОВНЕВЫХ
ТРАВМАХ ШЕЙНОГО ОТДЕЛА
ПОЗВОНОЧНИКА И СПИННОГО МОЗГА",Бюллетень медицинских интернет-конференций,8,11,,585,2018,,,https://elibrary.ru/item.asp?id=37164609,,,,,,,,,,,,,,,,,
7,,a36950335,"Курсов, С.  В.; Белецкий, А.  В.; Никонов, В.  В.; Киношенко, Е.  И.","ТРАВМА СЕРДЦА: КЛАССИФИКАЦИЯ,
МЕХАНИЗМЫ И ПРОБЛЕМЫ ДИАГНОСТИКИ У
ПОСТРАДАВШИХ С ТРАВМОЙ ГРУДНОЙ
КЛЕТКИ (ЛИТЕРАТУРНЫЙ ОБЗОР С
РЕЗУЛЬТАТАМИ СОБСТВЕННЫХ
НАБЛЮДЕНИЙ)",Медицина неотложных состояний,,8,,7--18,2018,,,https://elibrary.ru/item.asp?id=36950335,,,,,,,,,,,,,,,,,
7,,a37078110,"Лам, М.  М.","ЗАКОНОМЕРНОСТИ МОРФОГЕНЕЗА
СКЕЛЕТНЫХ ТКАНЕЙ ПОЗВОНОЧНИКА У
ДЕТЕЙ С ДИСПЛАЗИЕЙ СОЕДИНИТЕЛЬНЫХ
ТКАНЕЙ",Архив клинической и экспериментальной медицины,28,1,,40--44,2019,,,https://elibrary.ru/item.asp?id=37078110,,,,,,,,,,,,,,,,,
7,,a36646807,"Ларькин, И.  И.; Ларькин, В.  И.; Преображенский, А.  С.; Горева, Л.  М.","ТРАВМАТИЧЕСКИЕ ПОВРЕЖДЕНИЯ
СПИННОГО МОЗГА У ДЕТЕЙ",Политравма,,4,,46--50,2018,,,https://elibrary.ru/item.asp?id=36646807,,,,,,,,,,,,,,,,,
7,,a36871045,"Ластевский, А.  Д.; Рерих, В.  В.; Батаев, В.  А.; Веселов, С.  В.","ФИКСИРУЮЩИЕ СВОЙСТВА КЕРАМИЧЕСКИХ
ИМПЛАНТОВ ПРИ ВЕНТРАЛЬНОЙ
СТАБИЛИЗАЦИИ СУБАКСИАЛЬНЫХ ШЕЙНЫХ
СЕГМЕНТОВ В ЭКСПЕРИМЕНТЕ (ОБЗОР
ЛИТЕРАТУРЫ И РЕЗУЛЬТАТЫ
СОБСТВЕННЫХ ИССЛЕДОВАНИЙ)",Современные проблемы науки и образования,,6,,133,2018,,,https://elibrary.ru/item.asp?id=36871045,,,,,,,,,,,,,,,,,
7,,a35234420,"Левин, Д.  П.","ОЦЕНКА ДЕЙСТВИЯ КИНЕТИЧЕСКИХ
НЕЛЕТАЛЬНЫХ ЭЛЕМЕНТОВ",Инженерный журнал: наука и инновации,,7,,1,2018,,,https://elibrary.ru/item.asp?id=35234420,,,,,,,,,,,,,,,,,
7,,a36715244,"Левин, О.  С.","ОСОБЕННОСТИ ДИАГНОСТИКИ И ЛЕЧЕНИЯ
ВЕРТЕБРОГЕННЫХ БОЛЕВЫХ СИНДРОМОВ У
ПОЖИЛЫХ ПАЦИЕНТОВ",Фарматека,,14,,59--66,2018,,,https://elibrary.ru/item.asp?id=36715244,,,,,,,,,,,,,,,,,
7,,a35134860,"Левин, О.  С.; Небожин, А.  И.","ОСОБЕННОСТИ ЛЕЧЕНИЯ
ВЕРТЕБРОГЕННЫХ БОЛЕВЫХ СИНДРОМОВ У
ПОЖИЛЫХ",Современная терапия в психиатрии и неврологии,,2,,13--17,2018,,,https://elibrary.ru/item.asp?id=35134860,,,,,,,,,,,,,,,,,
7,,a36467983,"Либуркина, С.  П.; Васильев, А.  Н.; Каплан, А.  Я.; Иванова, Г.  Е.; Чуканова, А.  С.","ПИЛОТНОЕ ИССЛЕДОВАНИЕ
ИДЕОМОТОРНОГО ТРЕНИНГА В КОНТУРЕ
ИНТЕРФЕЙСА МОЗГ-КОМПЬЮТЕР У
ПАЦИЕНТОВ С ДВИГАТЕЛЬНЫМИ
НАРУШЕНИЯМИ",Журнал неврологии и психиатрии им. C.C. Корсакова,118,9,,63--68,2018,,,https://elibrary.ru/item.asp?id=36467983,,,,,,,,,,,,,,,,,
7,,a35142510,"Лившиц, М.  И.; Лобанкин, П.  В.; Петров, М.  А.; Шляпникова, Н.  С.; Павлова","ОПЫТ ХИРУРГИЧЕСКОГО ЛЕЧЕНИЯ
ТЯЖЕЛЫХ ТРАВМ ШЕЙНОГО ОТДЕЛА
ПОЗВОНОЧНИКА У ДЕТЕЙ",Московская медицина,,NaN,,74--75,2017,,,https://elibrary.ru/item.asp?id=35142510,,,,,,,,,,,,,,,,,
7,,a36408847,"Литвиненко, И.  В.; Живолупов, С.  А.; Булатов, А.  Р.; Кузина, Е.  Э.; Провоторов, Е.  А.","МНОГОУРОВНЕВЫЕ ПОРАЖЕНИЯ
ПЕРИФЕРИЧЕСКОЙ НЕРВНОЙ СИСТЕМЫ В
КЛИНИЧЕСКОЙ ПРАКТИКЕ ВОЕННОЙ И
МОРСКОЙ МЕДИЦИНЫ",Морская медицина,4,3,,26--35,2018,,,https://elibrary.ru/item.asp?id=36408847,,,,,,,,,,,,,,,,,
7,,a37101551,"Лихачев, С.  В.; Зарецков, В.  В.; Арсениевич, В.  Б.; Шульга, А.  Е.; Щаницын, И.  Н.; Скрипаченко, К.  К.","БИОМЕХАНИЧЕСКИЕ АСПЕКТЫ
ЦИРКУЛЯРНОГО СПОНДИЛОСИНТЕЗА
ПЕРЕХОДНОГО ГРУДОПОЯСНИЧНОГО
ОТДЕЛА ПОЗВОНОЧНИКА",Саратовский научно-медицинский журнал,14,3,,560--566,2018,,,https://elibrary.ru/item.asp?id=37101551,,,,,,,,,,,,,,,,,
7,,a37096166,"Лихачев, С.  В.; Зарецков, В.  В.; Шульга, А.  Е.; Грамма, С.  А.; Щаницын, И.  Н.; Бажанов, С.  П.; Зарецков, А.  В.; Донник, А.  М.","ПОВРЕЖДЕНИЯ ПЕРЕХОДНОГО
ГРУДОПОЯСНИЧНОГО ОТДЕЛА
ПОЗВОНОЧНИКА: БИБЛИОМЕТРИЧЕСКИЙ
АНАЛИЗ АНГЛОЯЗЫЧНОЙ ЛИТЕРАТУРЫ",Хирургия позвоночника,15,4,,52--69,2018,,,https://elibrary.ru/item.asp?id=37096166,,,,,,,,,,,,,,,,,
7,,a35538560,"Лосик, Е.  А.; Фадеева, М.  В.; Щегельский, В.  В.; Рзаев, Р.  Т.; Степанов, А.  В.; Пузаков, К.  Б.; Схиртладзе, М.  Р.","БЕССИМПТОМНЫЙ ПОСТТРАВМАТИЧЕСКИЙ
РАЗРЫВ ПРАВОГО КУПОЛА ДИАФРАГМЫ","Российский журнал гастроэнтерологии, гепатологии, колопроктологии",28,4,,102--109,2018,,,https://elibrary.ru/item.asp?id=35538560,,,,,,,,,,,,,,,,,
7,,a36461771,"Лочехина, Е.  Б.; Куликов, А.  С.; Уланова, А.  С.; Григорьева, Н.  А.","ПЕРЕЛОМЫ КОСТЕЙ ПРИ ОСТРОМ
ЛИМФОБЛАСТНОМ ЛЕЙКОЗЕ У ДЕТЕЙ",Бюллетень Северного государственного медицинского университета,,1,,39--41,2018,,,https://elibrary.ru/item.asp?id=36461771,,,,,,,,,,,,,,,,,
7,,a35370374,"Лубнин, А.  Ю.; Авхледиани, К.  Н.; Согомонян, С.  А.","НЕЙРОХИРУРГИЧЕСКАЯ ПАТОЛОГИЯ У
БЕРЕМЕННЫХ. АНЕСТЕЗИОЛОГИЧЕСКИЕ И
ТАКТИЧЕСКИЕ АСПЕКТЫ",Вестник интенсивной терапии имени А.И. Салтанова,,1,,5--15,2018,,,https://elibrary.ru/item.asp?id=35370374,,,,,,,,,,,,,,,,,
7,,a35686814,"Лушпаева, Ю.  А.; Патрикеева, И.  М.; Фадиенко, Г.  Р.","АЛГОРИТМ ВЕДЕНИЯ ПАЦИЕНТОВ С
МЫШЕЧНО-СКЕЛЕТНОЙ БОЛЬЮ В
АМБУЛАТОРНЫХ УСЛОВИЯХ",Медицинская наука и образование Урала,19,3,,117--123,2018,,,https://elibrary.ru/item.asp?id=35686814,,,,,,,,,,,,,,,,,
7,,a37164597,"Лымарев, М.  В.; Чехонацкий, В.  А.","ОСЛОЖНЕНИЯ ТРАВМЫ ПОЗВОНОЧНИКА И
СПИННОГО МОЗГА: ОСОБЕННОСТИ
ДИАГНОСТИКИ И ЛЕЧЕНИЯ",Бюллетень медицинских интернет-конференций,8,11,,573,2018,,,https://elibrary.ru/item.asp?id=37164597,,,,,,,,,,,,,,,,,
7,,a36493082,"Ляховецкая, В.  В.; Васильченко, Е.  М.; Коновалова, Н.  Г.","ЭФФЕКТИВНОСТЬ ОБУЧЕНИЯ ПАЦИЕНТОВ
С ТРАВМАТИЧЕСКОЙ БОЛЕЗНЬЮ СПИННОГО
МОЗГА НАВЫКАМ ПОЛЬЗОВАНИЯ
КРЕСЛОМ-КОЛЯСКОЙ",Медицина в Кузбассе,17,4,,11--14,2018,,,https://elibrary.ru/item.asp?id=36493082,,,,,,,,,,,,,,,,,
7,,a35582932,"Магомедов, Ш.  Ш.; Докиш, М.  Ю.; Татаринцев, А.  П.","ТРАНСПЕДИКУЛЯРНАЯ ФИКСАЦИЯ
ШЕЙНОГО ОТДЕЛА ПОЗВОНОЧНИКА В
СУБАКСИАЛЬНОЙ ЗОНЕ ПО МЕТОДИКЕ
FREE-HAND",Хирургия позвоночника,15,3,,13--22,2018,,,https://elibrary.ru/item.asp?id=35582932,,,,,,,,,,,,,,,,,
7,,a35166872,"Магомедов, Ш.  Ш.; Роминский, С.  П.; Докиш, М.  Ю.","ХИРУРГИЧЕСКОЕ ЛЕЧЕНИЕ
ПОСТТРАВМАТИЧЕСКОЙ КИФОТИЧЕСКОЙ
ДЕФОРМАЦИИ ПОЗВОНОЧНИКА ИЗ ЗАДНЕГО
ДОСТУПА В ПОЗДНЕМ ПЕРИОДЕ
ПОЗВОНОЧНО-СПИННОМОЗГОВОЙ ТРАВМЫ",Современные проблемы науки и образования,,3,,59,2018,,,https://elibrary.ru/item.asp?id=35166872,,,,,,,,,,,,,,,,,
7,,a36346991,"Мазуренко, А.  Н.; Криворот, К.  А.; Залепугин, С.  Д.; Егорова, З.  В.","КЛИНИКА, ДИАГНОСТИКАИ
ХИРУРГИЧЕСКОЕ ЛЕЧЕНИЕ ТЯЖЕЛЫХ
ПОВРЕЖДЕНИЙ ПОЗВОНОЧНИКА У ДЕТЕЙ
НА СОВРЕМЕННОМ ЭТАПЕ",Хирургия Восточная Европа,,3,,347--354,2018,,,https://elibrary.ru/item.asp?id=36346991,,,,,,,,,,,,,,,,,
7,,a35582933,"Мазуренко, А.  Н.; Пустовойтенко, В.  Т.; Макаревич, С.  В.; Криворот, К.  А.; Сомова, И.  Н.","ВАРИАНТЫ ВНЕДРЕНИЯ СЕТЧАТОГО
ТИТАНОВОГО ИМПЛАНТАТА В ТЕЛА
ПОЯСНИЧНЫХ ПОЗВОНКОВ ПРИ ПЕРЕДНЕМ
СПОНДИЛОДЕЗЕ",Хирургия позвоночника,15,3,,23--29,2018,,,https://elibrary.ru/item.asp?id=35582933,,,,,,,,,,,,,,,,,
7,,a36930813,"Малевич, Э.  Е.; Водянова, О.  В.","МЕТОДЫ ЛУЧЕВОЙ ДИАГНОСТИКИ В
ОЦЕНКЕ ПЕРЕЛОМОВ ПОЗВОНКОВ ПРИ
ОСТЕОПОРОЗЕ",Международные обзоры: клиническая практика и здоровье,,4,,6--21,2018,,,https://elibrary.ru/item.asp?id=36930813,,,,,,,,,,,,,,,,,
7,,a35235158,"Малыгина, А.  А.; Гребенникова, Т.  А.; Тюльпаков, А.  Н.; Белая, Ж.  Е.","НЕСОВЕРШЕННЫЙ ОСТЕОГЕНЕЗ КАК
ПРИЧИНА ЛЕТАЛЬНОГО ИСХОДА",Остеопороз и остеопатии,21,1,,23--27,2018,,,https://elibrary.ru/item.asp?id=35235158,,,,,,,,,,,,,,,,,
7,,a37281011,"Мамбетова, Г.  Ш.; Такенов, Ж.  Т.; Мустафаева, А.  С.; Садырбекова, А.  К.; Кисаев, Е.  В.; Сыдыкова, К.  Т.; Абишева, А.  К.; Бергенева, А.  А.","ПРИМЕНЕНИЕ РАННЕЙ ВЕРТИКАЛИЗАЦИИ
В НЕЙРОРЕАБИЛИТАЦИИ",Нейрохирургия и неврология Казахстана,,4,,26--34,2018,,,https://elibrary.ru/item.asp?id=37281011,,,,,,,,,,,,,,,,,
7,,a36460399,"Мансур, Т.; Демирчи, Г.; Узунисмаил, А.; Йылдыз, С.","ГЕРПЕТИЧЕСКАЯ ЭКЗЕМА КАПОШИ -
РЕДКОЕ ОСЛОЖНЕНИЕ ЭКСТРАКЦИИ
ФОЛЛИКУЛЯРНЫХ ЕДИНИЦ",Трихология,,1,,156--159,2018,,,https://elibrary.ru/item.asp?id=36460399,,,,,,,,,,,,,,,,,
7,,a36894304,"Марданов, Р.  Р.; Поверин, Г.  В.; Королева, М.  А.; Зимин, С.  Н.; Егорова, О.  О.; Шаимова, Д.  В.","ОПЫТ ЛЕЧЕНИЯ ДЕТЕЙ С
ОСТЕОМИЕЛИТОМ КОСТЕЙ ТАЗА",Детская хирургия,23,1,,39,2019,,,https://elibrary.ru/item.asp?id=36894304,,,,,,,,,,,,,,,,,
7,,a35296705,"Марков, А.  А.; Сергеев, К.  С.; Ситдиков, И.  Р.","РЕТРОСПЕКТИВНЫЙ АНАЛИЗ
НЕУДОВЛЕТВОРИТЕЛЬНЫХ РЕЗУЛЬТАТОВ
ОПЕРАТИВНОГО ЛЕЧЕНИЯ ПАЦИЕНТОВ С
ПЕРЕЛОМАМИ НА ФОНЕ ОСТЕОПОРОЗА",Современная наука и инновации,,4,,174--178,2017,,,https://elibrary.ru/item.asp?id=35296705,,,,,,,,,,,,,,,,,
7,,a35491004,"Марочков, А.  В.; Печерский, В.  Г.; Липницкий, А.  Л.; Абелевич, А.  И.; Артюхова, А.  А.","СПИНАЛЬНАЯ АНЕСТЕЗИЯ И СОДЕРЖАНИЕ
КОРТИЗОЛАУ ПАЦИЕНТОВ ПРИ ОПЕРАЦИЯХ
НА НИЖНИХ КОНЕЧНОСТЯХ",Регионарная анестезия и лечение острой боли,12,2,,91--97,2018,,,https://elibrary.ru/item.asp?id=35491004,,,,,,,,,,,,,,,,,
7,,a35265385,"Мартикян, А.  Г.; Гринь, А.  А.","ДИАГНОСТИКА, ПАТОГЕНЕЗ И ЛЕЧЕНИЕ
ПОВРЕЖДЕНИЙ ТВЕРДОЙ МОЗГОВОЙ
ОБОЛОЧКИ ПРИ
ПОЗВОНОЧНО-СПИННОМОЗГОВОЙ ТРАВМЕ",Нейрохирургия,20,2,,74--82,2018,,,https://elibrary.ru/item.asp?id=35265385,,,,,,,,,,,,,,,,,
7,,a35080844,"Мартюшева, М.  В.; Мальцева, О.  А.","СТОМАТОЛОГИЧЕСКИЙ СТАТУС
ПАЦИЕНТОВ, НУЖДАЮЩИХСЯ В
ПРОТЕТИЧЕСКОМ ЛЕЧЕНИИ",Вятский медицинский вестник,,1,,71--75,2018,,,https://elibrary.ru/item.asp?id=35080844,,,,,,,,,,,,,,,,,
7,,a36311326,"Марущак, М.  І.; Худоб'як, М.  М.; Габор, Г.  Г.","ОСОБЛИВОСТІ МІТОХОНДРІАЛЬНОГО Й
МІКРОСОМАЛЬНОГО ОКИСНЕННЯ У
ПОСТОПЕРАЦІЙНОМУ ПЕРІОДІ ПІСЛЯ
ПОЄДНАНОЇ ТРАВМИ ГРУДНОЇ КЛІТКИ ТА
ОБОХ СТЕГОН В ЕКСПЕРИМЕНТІ",Вестник проблем биологии и медицины,2,4,,91--95,2016,,,https://elibrary.ru/item.asp?id=36311326,,,,,,,,,,,,,,,,,
7,,a36543277,"Марущак, М.  І.; Худоб'як, М.  М.; Габор, Г.  Г.","ОСОБЛИВОСТІ МІТОХОНДРІАЛЬНОГО Й
МІКРОСОМАЛЬНОГО ОКИСНЕННЯ У
ПОСТОПЕРАЦІЙНОМУ ПЕРІОДІ ПІСЛЯ
ПОЄДНАНОЇ ТРАВМИ ГРУДНОЇ КЛІТКИ ТА
ОБОХ СТЕГОН В ЕКСПЕРИМЕНТІ",Вестник проблем биологии и медицины,4,3,,91--95,2015,,,https://elibrary.ru/item.asp?id=36543277,,,,,,,,,,,,,,,,,
7,,a35663900,"Марченкова, Л.  А.; Макарова, Е.  В.","ЭФФЕКТИВНЫЕ ВОЗМОЖНОСТИ
КОМПЛЕКСНОЙ РЕАБИЛИТАЦИИ ПАЦИЕНТОВ
С ПЕРЕЛОМАМИ НА ФОНЕ ОСТЕОПОРОЗА",РМЖ,26,4,,10--14,2018,,,https://elibrary.ru/item.asp?id=35663900,,,,,,,,,,,,,,,,,
7,,a37219092,"Маскаева, Т.  Ю.; Урываев, Ю.  В.; Греков, Ю.  А.; Руцкий, Д.  А.","СКЕЛЕТНЫЕ ЗВЕНЬЯ ТЕЛА СТУДЕНТОВ
МЛАДШИХ КУРСОВ ВУЗА",Ученые записки университета им. П.Ф. Лесгафта,,3,,195--200,2019,,,https://elibrary.ru/item.asp?id=37219092,,,,,,,,,,,,,,,,,
7,,a37308168,"Масляков, В.  В.; Барсуков, В.  Г.; Усков, А.  В.","ВИДЫ ОПЕРАТИВНЫХ ВМЕШАТЕЛЬСТВ,
ВЫПОЛНЯЕМЫХ ПРИ РАНЕНИЯХ ШЕИ В
ГРАЖДАНСКОМ ЛЕЧЕБНОМ УЧРЕЖДЕНИИ В
УСЛОВИЯХ ЛОКАЛЬНОГО ВОЕННОГО
КОНФЛИКТА",Исследования и практика в медицине,6,1,,106--111,2019,,,https://elibrary.ru/item.asp?id=37308168,,,,,,,,,,,,,,,,,
7,,a35255993,"Матвеев, А.  В.; Крашенинников, А.  Е.; Егорова, Е.  А.","СОВРЕМЕННЫЙ ВЗГЛЯД НА
ЭФФЕКТИВНОСТЬ И БЕЗОПАСНОСТЬ
КЕТОРОЛАКА",Русский медицинский журнал. Медицинское обозрение,2,4,,34--39,2018,,,https://elibrary.ru/item.asp?id=35255993,,,,,,,,,,,,,,,,,
7,,a36894311,"Меньщиков, П.  Е.; Иванцова, А.  С.; Ахадов, Т.  А.; Ублинский, М.  В.; Манжурцев, А.  В.; Семенова, Н.  А.","ОЦЕНКА ПЛОТНОСТИ КОСТНОЙ ТАКНИ У
ДЕТЕЙ С КОМПРЕССИОННЫМ ПЕРЕЛОМОМ
ПОЗВОНОЧНИКА МЕТОДОМ
МАГНИТНО-РЕЗОНАНСНОЙ
СПЕКТРОСКОПИИ",Детская хирургия,23,1,,42,2019,,,https://elibrary.ru/item.asp?id=36894311,,,,,,,,,,,,,,,,,
7,,a35467417,"Мизюров, С.  А.","ОСОБЕННОСТИ ХИРУРГИЧЕСКОЙ
РЕКОНСТРУКЦИИ ПОЗВОНКА ПРИ
АГРЕССИВНЫХ ГЕМАНГИОМАХ
ПЕРЕХОДНОГО ШЕЙНО-ГРУДНОГО ОТДЕЛА
ПОЗВОНОЧНИКА",Бюллетень медицинских интернет-конференций,8,5,,174,2018,,,https://elibrary.ru/item.asp?id=35467417,,,,,,,,,,,,,,,,,
7,,a36421224,"Минаков, А.  Н.; Чернов, А.  С.; Асютин, Д.  С.; Коновалов, Н.  А.; Телегин, Г.  Б.","ЭКСПЕРИМЕНТАЛЬНОЕ МОДЕЛИРОВАНИЕ
ТРАВМЫ СПИННОГО МОЗГА У
ЛАБОРАТОРНЫХ КРЫС",Acta Naturae (русскоязычная версия),10,3,,4--10,2018,,,https://elibrary.ru/item.asp?id=36421224,,,,,,,,,,,,,,,,,
7,,a37096164,"Миронов, С.  П.; Колесов, С.  В.; Переверзев, В.  С.; Колбовский, Д.  А.; Кулешов, А.  А.; Ветрилэ, М.  С.; Казьмин, А.  И.","ОПЫТ ХИРУРГИЧЕСКОГО ЛЕЧЕНИЯ
КРАНИОВЕРТЕБРАЛЬНОГО СТЕНОЗА У
ПАЦИЕНТОВ С МУКОПОЛИСАХАРИДОЗОМ I,
II, VI ТИПОВ",Хирургия позвоночника,15,4,,32--40,2018,,,https://elibrary.ru/item.asp?id=37096164,,,,,,,,,,,,,,,,,
7,,a36574902,"Михайлова, М.  М.; Пальцев, М.  А.; Пантелеев, А.  А.","МОДЕЛИРОВАНИЕ ПРОЦЕССА
РЕГЕНЕРАЦИИ СПИННОГО МОЗГА В
СИСТЕМЕ IN VITRO",Молекулярная медицина,16,6,,3--8,2018,,,https://elibrary.ru/item.asp?id=36574902,,,,,,,,,,,,,,,,,
7,,a35177239,"Млявых, С.  Г.; Боков, А.  Е.; Яшин, К.  С.; Карякин, Н.  Н.; Anderson, D.  G.","ТЕХНОЛОГИЯ УДЛИНЕНИЯ НОЖЕК
ПОЗВОНКОВ ПРИ ПОЯСНИЧНОМ СТЕНОЗЕ:
ПРОВЕДЕНИЕ ДОКЛИНИЧЕСКИХ ИСПЫТАНИЙ
НОВЫХ ОРТОПЕДИЧЕСКИХ ИМПЛАНТАТОВ",Современные технологии в медицине,10,2,,37--46,2018,,,https://elibrary.ru/item.asp?id=35177239,,,,,,,,,,,,,,,,,
