key,title,year,month,day,journal,issn,volume,issue,pages,authors,url,language,publisher,location,abstract,notes
10472098,Urgent surgical stabilization of spinal fractures in polytrauma patients.,1999,1,15,Spine,,24,16,1646-54,"McLain, R F and Benson, D R",https://www.ncbi.nlm.nih.gov/pubmed/10472098,eng,,,"Study design: 
A prospective, longitudinal study of multiply injured patients treated with segmental instrumentation for spinal fractures with a minimum 2-year follow-up.
Objectives: 
To determine whether urgent stabilization of spinal fractures in severely injured patients increases the risk of surgery compared with early treatment and historical results.
Summary and background data: 
Opinion in clinical studies is divided about whether operative treatment offers an advantage over nonoperative treatment in isolated spine fractures. Concomitant trauma is rarely discussed relative to decision making or surgical timing. Urgent stabilization of long-bone fractures improves survival and outcome in polytrauma patients. To date, urgent treatment of spine fractures in polytrauma patients has not been considered in the literature.
Methods: 
Seventy-five consecutive patients treated with segmental instrumentation for spinal trauma were observed prospectively to assess perioperative and longterm outcome. Twenty-seven patients with severe polytrauma (injury severity score, > 26) were separately analyzed. Perioperative and postoperative results were analyzed relative to timing of surgery, injury severity score, and surgical approach. Urgent treatment was defined as that provided within 24 hours of the spinal injury, and early treatment was defined as that provided between 24 and 72 hours after injury.
Results: 
Twenty-five patients (93%) sustained two or more major injuries in addition to the spine fracture, and 17 of 27 (63%) had neurologic injury. The mean injury severity score approached or exceeded the LD50 (50% expected mortality) in each group--36.0 for the early-treatment group and 42.0 for the urgent group--but only one patient in each group died. There were no deep venous thromboses, pulmonary emboli, neurologic injuries, decubiti, deep wound infections, or episodes of sepsis in either group. Blood loss for anterior procedures was significantly higher in the urgent group, but estimated blood loss for posterior procedures was similar for both groups. At 49 months' mean follow-up, no revisions were necessitated by the urgent spinal treatment.
Conclusions: 
Urgent spinal stabilization is safe and appropriate in polytrauma patients when progressive neurologic deficit, thoracoabdominal trauma, or fracture instability increase the risks of delayed treatment."," RAYYAN-INCLUSION: {""Pavel""=>false, ""dursunov.eldar97""=>true} | RAYYAN-EXCLUSION-REASONS: шаг 9 - НСО или НРИ [Records Excluded Step 9a NSR or NRS]"
9637621,Management options in thoracolumbar burst fractures.,1998,1,1,Surgical neurology,1879-3339,49,6,619-26; discussion 626-7,"Hitchon, P W and Torner, J C and Haddad, S F and Follett, K A",https://www.ncbi.nlm.nih.gov/pubmed/9637621,eng,,,"Background: 
Both surgery and recumbency have been adopted in the treatment of spinal fractures. Herein we present the indications for each, and our experience with thoracolumbar junction (T12, L1 and L2) burst fractures.
Methods: 
Sixty-eight patients with thoracolumbar burst fractures were treated operatively in 36 cases, and nonoperatively in 32 with recumbency for 1-6 weeks. Treatment was based on clinical and radiological criteria. Eighty-one percent of the recumbency patients, but only 14% of the surgical patients were intact on admission. Patients were followed for a mean+/-SD of 9+/-10 months in the recumbency group, and 21+/-21 months in the surgical group.
Results: 
Neurological improvement and progressive angular deformity occurred in both groups. The cost of recumbency in our patients was nearly half that of those who required surgery, though the length of hospitalization between the two groups was similar at 1 month +/-2 weeks.
Conclusion: 
The above study emphasizes that the selection of operative versus nonoperative treatment in burst fractures should not be random but based on clinical as well as radiological criteria. Recumbency is favored in patients who are intact, with angular deformity less than 20 degrees , a residual spinal canal greater than 50% of normal, and an anterior body height exceeding 50% of the posterior height. Surgical intervention is generally indicated in patients with partial neurological deficit, and those with severe instability."," RAYYAN-INCLUSION: {""Pavel""=>false, ""dursunov.eldar97""=>true} | RAYYAN-EXCLUSION-REASONS: шаг 9 - НСО или НРИ [Records Excluded Step 9a NSR or NRS]"
9460160,Mechanical stability of the AO internal spinal fixation system compared with that of the Hartshill rectangle and sublaminar wiring in the management of unstable burst fractures of the thoracic and lumbar spine.,1998,1,1,Spine,,23,1,111-5,"Cresswell, T R and Marshall, P D and Smith, R B",https://www.ncbi.nlm.nih.gov/pubmed/9460160,eng,,,"Study design: 
A radiographic comparison of the mechanical efficacy of the Hartshill rectangle and that of the AO internal spinal skeletal fixation systems in the management of unstable burst fractures of the thoracic and lumbar spine.
Objectives: 
To study the restoration and maintenance of normal spinal anatomy after open reduction and internal fixation of unstable burst fractures of the thoracic and lumbar spine.
Summary of background data: 
There are laboratory studies documenting the biomechanical advantages of the AO internal spinal skeletal fixation systems. There have been no previous comparisons of the internal spinal skeletal fixation system with the Hartshill rectangle and sublaminar wiring in matched patient groups.
Methods: 
Radiographs obtained before surgery, immediately after surgery, and at 2 years after surgery were used to assess the restoration and maintenance of normal spinal anatomy in 14 patients who had undergone stabilization with the Hartshill System and in 12 patients who had undergone internal fixation using the AO internal spinal skeletal fixation system.
Results: 
The initial restoration of normal spinal anatomy was good using both systems. However, on examination 2 years after surgery, it was found that the AO system provided significantly superior maintenance of both middle (P < 0.01) and anterior column anatomy (P < 0.001).
Conclusion: 
The AO internal spinal skeletal fixation systems is associated with significantly superior maintenance of spinal anatomy 2 years after surgery."," RAYYAN-INCLUSION: {""Pavel""=>false, ""dursunov.eldar97""=>true} | RAYYAN-EXCLUSION-REASONS: шаг 9 - НСО или НРИ [Records Excluded Step 9a NSR or NRS]"
8913955,Thoracolumbar fractures without neurosurgical involvement: surgical or conservative treatment?,1996,1,1,Journal of neurosurgical sciences,0390-5616,40,1,01. Okt,"Domenicucci, M and Preite, R and Ramieri, A and Ciappetta, P and Delfini, R and Romanini, L",https://www.ncbi.nlm.nih.gov/pubmed/8913955,eng,,,"The decision whether to treat amyelic thoracolumbar fractures conservatively or by surgical approach depends mainly on radiographic and clinical evaluation of their potential stability. An angle of kyphosis of 20 degrees or more evaluated using the sagittal index (s.i.) described by Farcy et al. in 1990, may be a valid indication for invasine treatment using pedicular systems for correction and stabilization; on the other hand, conservative treatment may be adequate for ensuring satisfactory results in fractures with an angle of less than 20 degrees, which are less likely to become unstable in clinically negative patients. This study confronts the immediate and long-term radiographic and clinical results in 2 groups of patients treated for amyelic thoracolumbar fractures, one treated conservatively, the other surgically; in particular, angle of kyphosis, vertebral compression and clinical conditions (pain and functional impairment) at long-term follow-up were assessed. The study was extended to include an assessment of outcome in relation to the angle of post-traumatic kyphosis in both operated and non-operated patients. Thirty-one patients with a diagnosis of non-neurological thoracolumbar trauma of the segment between D11 and L3 were studied. Twenty patients (group A) were treated conservatively (reduction on Cotrel bed and plaster vest) and 11 (group B) surgically (Diapason instrumentation). The 31 patients were subdivided into 2 groups according to the initial angle of kyphosis calculated using the s.i.: the first consisted of 16 patients (group C) with a s.i. of 20 degrees or more and the other of 15 patients (group D) with a s.i. less than 20 degrees. Six of the 16 group C patients and 5 of the 15 group D patients had been surgically treated. On the basis of the case-material considered, we found that satisfactory short-term radiographic results may be obtained by both conservative and surgical treatment. However, long-term outcome is less favorable in patients treated conservatively because maintainance of the initial improvement of the deformity in the injured segment is not as good as in those treated surgically. This limitation of conservative treatment does not however appear to negatively influence clinical conditions in patients with a s.i. of less than 20 degrees. In other words, although conservative treatment is not as effective as surgery for maintaining radiographic improvement, this does not necessarily signify clinical deterioration in cases with a s.i. of less than 20 degrees in whom the two types of treatment gave similar results."," RAYYAN-INCLUSION: {""Pavel""=>false, ""dursunov.eldar97""=>true} | RAYYAN-EXCLUSION-REASONS: шаг 9 - НСО или НРИ [Records Excluded Step 9a NSR or NRS]"
8814573,Timing of surgical decompression and fixation of acute spinal fractures.,1996,1,1,Journal of orthopaedic trauma,1531-2291,10,5,323-30,"Schlegel, J and Bayley, J and Yuan, H and Fredricksen, B",https://www.ncbi.nlm.nih.gov/pubmed/8814573,eng,,,"A retrospective evaluation of 138 patients requiring operative decompression, reduction and fixation of spinal injuries between January 1986 and April 1989 was conducted. The variables of timing and method of operative intervention, level and classification of fracture, associated injuries, injury severity score (ISS), associated neurologic deficits, length of intensive care unit and hospital stays, and projected costs were analyzed for correlation with postoperative complications (pulmonary, skin, urinary, other). Four subgroups were identified: group IA patients underwent surgery within 72 h of injury and had an ISS of < 18; group IB patients underwent surgery after 72 h and had an ISS of < 18; group IIA patients underwent surgery within 72 h and had an ISS of > or = 18; and group IIB underwent surgery after 72 h and had an ISS of > or = 18. There was no statistically significant difference in the incidence of medical complications in patients comparing groups IA and IB. Group IIB patients had a statistically significant higher rate of morbidity than did group IIA. A separate group of patients with cervical spine injuries with neurologic deficit was analyzed by the same statistical analysis. Irrespective of associated injuries, all had fewer complications if they underwent surgery within 72 h. Morbidity was higher in patients with a neurological deficit compared with neurologically intact patients. Surgical decompression, reduction, and/or fixation of spinal fractures within the first 72 h is indicated in patients with multiple trauma (ISS > or = 18) and cervical injuries with a neurological deficit."," RAYYAN-INCLUSION: {""Pavel""=>false, ""dursunov.eldar97""=>true} | RAYYAN-EXCLUSION-REASONS: шаг 9 - НСО или НРИ [Records Excluded Step 9a NSR or NRS]"
7479408,A comparison study of treatment of thoracolumbar fractures using the ACE Posterior Segmental Fixator and Cotrel-Dubousset instrumentation.,1995,1,1,Orthopedics,,18,7,679-86,"Markel, D C and Graziano, G P",https://www.ncbi.nlm.nih.gov/pubmed/7479408,eng,,,"The results of 26 consecutive thoracolumbar fractures treated with Cotrel-Dubousset instrumentation (CDI) (n = 12) or the ACE Posterior Segmental Fixator (n = 14) with a mean follow up of 20.2 months were analyzed. Preoperatively, no statistically significant difference was noted between the two treatment groups. Postoperatively, no statistically significant difference was noted for improvement of kyphosis (mean: -6.00 degrees ACE, 1.92 degrees CDI), vertebral body height (mean: 17.86% ACE, 18.83% CDI), vertebral body angle (mean: -6.21 degrees ACE, -5.42 degrees CDI), or estimated blood loss (mean: 1544 cc ACE, 1620 cc CDI). All patients with incomplete paraplegia improved by at least one Frankel grade. Statistically significant differences were noted in operative time (mean: 269 minutes ACE, 357 minutes CDI, P < .0005), and in the number of instrumented levels (mean: 3 ACE, 5.8 CDI). All patients exhibited solid fusion radiographically. Thoracolumbar fractures can be effectively treated by either CDI or the ACE Fixator. The ACE Fixator has the advantage of sparing motion segments and decreased operative time."," RAYYAN-INCLUSION: {""Pavel""=>false, ""dursunov.eldar97""=>true} | RAYYAN-EXCLUSION-REASONS: шаг 9 - НСО или НРИ [Records Excluded Step 9a NSR or NRS]"
8178177,[Single segment internal fixator device in treatment of thoracolumbar vertebral fractures].,1994,1,1,Der Unfallchirurg,1433-044X,97,3,114-20,"Wawro, W and Konrad, L and Aebi, M",https://www.ncbi.nlm.nih.gov/pubmed/8178177,ger,,,"Treatment of vertebral fractures by the fixed-angle system of the internal fixator allows fusion over a short area and is the form of treatment now in general use. A bisegmental construction is usual, which means that reduction and relief of the injured vertebral body is achieved indirectly by means of two intact vertebrae immediately adjacent on either side. As a result, both segments stiffen up or are permanently damaged in their function. We report on the possibility of single-segment fixation. The principle is the fusion of the injured segment itself only, i.e., the vertebra actually injured and the vertebra adjacent to the injured segment. Unnecessary fixation of a second healthy segment can thus be avoided. The characteristics of the fracture type in which single-segment stabilization is possible are explained. In a small study of the technique, we used the new AO classification of vertebral fractures of the thoracolumbar spine. The operation technique differs in some details from that applied with a multisegmental internal fixator. For example, the pedicle screws occasionally need to be inserted extremely close to the end-plates if the remaining part of the vertebral body has been destroyed and therefore cannot provide stability. Contraindications are broken pedicles and complete burst fractures of the body. With due consideration for these limitations fractures in all three main groups of the AO classification can, in principle, be stabilized in a single segment. In the years 1988-1990, 14 patients were operated on in this way (12 acute injuries, 2 secondary operations).(ABSTRACT TRUNCATED AT 250 WORDS)"," RAYYAN-INCLUSION: {""Pavel""=>false, ""dursunov.eldar97""=>true} | RAYYAN-EXCLUSION-REASONS: шаг 9 - НСО или НРИ [Records Excluded Step 9a NSR or NRS]"
8300651,Ligamentotaxis with an internal spinal fixator for thoracolumbar fractures.,1994,1,1,The Journal of bone and joint surgery. British volume,0301-620X,76,1,107-12,"Kuner, E H and Kuner, A and Schlickewei, W and Mullaji, A B",https://www.ncbi.nlm.nih.gov/pubmed/8300651,eng,,,"We assessed narrowing of the spinal canal in 39 burst fractures and fracture-dislocations of thoracolumbar vertebrae treated by the AO Internal Spinal Fixator, using CT preoperatively and at various stages postoperatively. Computer-aided planimetry was used to measure the narrowing, and its restoration shortly after instrumentation, or at 15 months. The mean initial reduction of canal area was to 63.7% +/- 18.8% of normal; this was restored to a mean of 95.4% +/- 21.2% of normal when measured either soon after surgery or at 15 months (p < 0.001 for both groups). There was more improvement in cases assessed later. For fractures from D12 to L3, the mean canal area was restored to 99.4% of normal; but at L4 or L5 the mean restitution was to only 60.9% (p < 0.05). We found no correlation between preoperative loss of area and amount of restoration, or severity of neurological deficit. Nor was there any correlation between the delay before surgery and the improvement achieved. The mechanism of fracture reduction appears to be a combination of distraction ligamentotaxis and forced hyperextension."," RAYYAN-INCLUSION: {""Pavel""=>false, ""dursunov.eldar97""=>true} | RAYYAN-EXCLUSION-REASONS: шаг 9 - НСО или НРИ [Records Excluded Step 9a NSR or NRS]"
7874541,Fixation of thoracolumbar fractures with the Dick fixator: the influence of transpedicular bone grafting.,1994,1,1,"European spine journal : official publication of the European Spine Society, the European Spinal Deformity Society, and the European Section of the Cervical Spine Research Society",1432-0932,3,1,45-51,"Crawford, R J and Askin, G N",https://www.ncbi.nlm.nih.gov/pubmed/7874541,eng,,,"Fifty patients with thoracolumbar fractures were treated by internal fixation using the Dick fixator. In the first 22 patients (group 1) this was accompanied by posterior intertransverse grafting. The technique was then modified in the following 28 patients (group 2) to include transpedicular elevation of the depressed vertebral end plate and grafting of the vertebral body, in an attempt to reduce the postoperative loss of correction of the kyphotic deformity. The clinical records and X-rays were reviewed to determine whether the change in technique had achieved this objective and whether it affected operative time, blood loss, postoperative recovery and complications. The mean operating time and blood loss in group 1 were 2 h, 38 min and 650 ml, respectively, and in group 2 2 h, 59 min and 783 ml. These differences were not statistically significant. Time from operation to mobilisation and discharge from hospital were related to neurological deficit, but there was no significant difference between group 1 and group 2 in this regard. There was no difference in the complication rate between the two groups and no complication attributable to transpedicular bone grafting. The radiological results postoperatively and at a mean follow-up period of 9 months were assessed by measurement of the kyphosis angle, anterior vertebral height, anterior displacement, scoliosis, and reduction in cross-sectional area of the spinal canal. In group 1 the mean preoperative kyphosis angle and anterior vertebral height were 8 degrees and 21 mm; postoperatively these values were -12 degrees (lordosis) and 27 mm; and at follow-up they were -4 degrees and 24 mm.(ABSTRACT TRUNCATED AT 250 WORDS)"," RAYYAN-INCLUSION: {""Pavel""=>false, ""dursunov.eldar97""=>true} | RAYYAN-EXCLUSION-REASONS: шаг 9 - НСО или НРИ [Records Excluded Step 9a NSR or NRS]"
8237236,Transpedicular fixation in the treatment of various spinal disorders.,1993,1,1,Acta chirurgica Belgica,0001-5458,93,4,188-92,"Güven, O and Esemenli, T and Yalçin, S and Karahan, M",https://www.ncbi.nlm.nih.gov/pubmed/8237236,eng,,,"36 patients with 157 inserted pedicular screws are presented. The patients are evaluated in 5 different groups; group I: fractures, group II: spinal tuberculosis, group III: spinal tumours, group IV: spondylolisthesis and group V: scoliosis. The mean age and the mean follow-up of the groups are respectively 42 years and 10.8 months. Cotrel-Dubousset instrumentation (CD), Alici Instrumentation, Fixateur Interne (Dick) or Steffee plate are used to stabilize the spine. The low complication rate of pedicular screw insertion is related to the used technique."," RAYYAN-INCLUSION: {""Pavel""=>false, ""dursunov.eldar97""=>true} | RAYYAN-EXCLUSION-REASONS: шаг 9 - НСО или НРИ [Records Excluded Step 9a NSR or NRS]"
1553331,Low lumbar burst fractures: comparison between conservative and surgical treatments.,1992,1,1,Orthopedics,,15,3,367-73,"An, H S and Simpson, J M and Ebraheim, N A and Jackson, W T and Moore, J and O'Malley, N P",https://www.ncbi.nlm.nih.gov/pubmed/1553331,eng,,,"Twenty-two low lumbar burst fractures (L3-L5) were treated, with an average follow up of 56.2 and 39.0 months in the conservative and surgically treated groups, respectively. Twenty patients were available for review; seven were treated conservatively and 13 were stabilized surgically. All patients were evaluated clinically for work status, activity level, residual pain, and subsequent development of neurologic symptoms. Roentgenograms were reviewed for severity of initial fracture, canal compromise, and maintenance of initial correction. In general, neurologically intact patients in both groups returned to similar postinjury employment levels. Persistent back pain was found to be more disabling in the surgically treated group, in which a fusion incorporating four or five lumbar segments was performed. There was no evidence of significant loss of initial reduction, and no patients experienced late neurological compromise in the surgical group. An average follow-up kyphosis of 9.2 degrees and 31% loss of vertebral height were observed in the conservative group, while a follow-up lordosis of 1 degree and 19% loss of vertebral height were observed in the surgical group. Conservative treatment of low lumbar burst fracture is a viable option in neurologically intact patients, but loss of lordosis and vertebral height may persist. Biomechanical and anatomic characteristics of the low lumbar spine differ from the thoracolumbar region and may account for the inherent stability of these injuries. If surgery is chosen, a long fusion with distraction instrumentation should be avoided in the low lumbar spine. A short rigid fixation with pedicular instrumentation may be of greater benefit."," RAYYAN-INCLUSION: {""Pavel""=>false, ""dursunov.eldar97""=>true} | RAYYAN-EXCLUSION-REASONS: шаг 9 - НСО или НРИ [Records Excluded Step 9a NSR or NRS]"
1785100,Survivorship analysis of VSP spine instrumentation in the treatment of thoracolumbar and lumbar burst fractures.,1991,1,1,Spine,,16,8,S428-32,"Ebelke, D K and Asher, M A and Neff, J R and Kraker, D P",https://www.ncbi.nlm.nih.gov/pubmed/1785100,eng,,,"We used survivorship analysis to study 21 burst fractures that were treated with posterior VSP spine implant and fusion, each of which was over two motion segments. There were two treatment classes: 1) eight patients whose surgery included anterior bone grafting (augmentation), seven of which were done by the transpedicular approach; and 2) 13 patients whose surgery did not include anterior bone. Eight patients, seven of whom were in the second group, met at least one of the failure criteria. Life table calculations showed 100% implant survival through 22 months in the group treated with anterior bone augmentation, while the nonaugmented group showed 92% survival at 6 months, 68% survival at 9 months, 60% survival at 13 months, and 50% survival at 19 months. Statistical comparisons of the two groups resulted in P-values of 0.05 (Breslow) and 0.04 (Mantel-Cox). Based on this method of analysis, VSP instrumentation and two-level fusion is suitable surgical treatment for many burst fractures, but high failure rates may result if anterior bone augmentation is not performed."," RAYYAN-INCLUSION: {""Pavel""=>false, ""dursunov.eldar97""=>true} | RAYYAN-EXCLUSION-REASONS: шаг 9 - НСО или НРИ [Records Excluded Step 9a NSR or NRS]"
1439861,[Experimental trial of intraoperative spinal ultrasound].,1992,1,1,Der Unfallchirurg,1433-044X,95,10,493-7,"Degreif, J and Wenda, K and Ahlers, J and Ritter, G",https://www.ncbi.nlm.nih.gov/pubmed/1439861,ger,,,"Dorsal operative stabilization of spinal fractures by internal fixation is an established means of treatment directed at releasing the extrinsic compression of the intraspinal contents caused by the fractured posterior surface of the vertebral body. There are few ways of assessing how successful the repositioning is intraoperatively. Intraoperative ultrasound with a special small transducer is possible, but it is difficult to reach the intraspinal area by this means, because it is surrounded by bones. A laminectomy would destabilize the injured vertebral column even further. By experiments performed on six human vertebral columns we show that it is possible to view the entire length of the fractured posterior surface by ultrasound. The beam has to be projected between the laminae vertebrae following a small laminotomy. Preliminary intraoperative experiences with eight patients confirm our experimental results. The intraoperative ultrasound results have been confirmed by preoperative and postoperative CT. We expect the necessity for laminectomy for examination of the posterior surface of the vertebral body to decline in frequency in the near future."," RAYYAN-INCLUSION: {""Pavel""=>false, ""dursunov.eldar97""=>true} | RAYYAN-EXCLUSION-REASONS: шаг 1 - фаза 0-1 [Records Excluded Step 1 Animal or Cadaver or Biomech or In Vitro or In Silico or Healthy]"
