key,title,year,month,day,journal,issn,volume,issue,pages,authors,url,language,publisher,location,abstract,notes
25645322,[Percutaneous stabilization of the thoracic and lumbar spine with active intraoperative reduction].,2015,1,1,Operative Orthopadie und Traumatologie,,27,5,439-47,"Pishnamaz, M and Lichte, P and Sellei, R M and Pape, H-C and Kobbe, P",https://www.ncbi.nlm.nih.gov/pubmed/25645322,ger,,,"Objective: 
Operative treatment of vertebral fractures is focused on stabilization of the spine and decompression of the spinal cord and nerves. In German-speaking countries, it is common to restore the sagittal profile by fracture reduction. The use of percutaneous systems has been limited due to inferior reduction possibilities compared to open systems. The improved reduction options offered by newer percutaneous systems extend their application to highly deformed fractures.
Indications: 
Unstable thoracic, lumbar and lumbosacral spine fractures; unacceptable spinal deformities.
Contraindications: 
Need for open decompression or cross-bracing; relative contraindication: obesity or cachexia.
Surgical technique: 
3 cm skin incision 1.5 cm lateral to the radiological border of the pedicle. Incision of the fascia and blunt preparation to the facet joints. Guidewire placement via fluoroscopy. Tapping and cannulated screw setting. Insertion of the longitudinal rods and reduction using special reduction tools. Rod fixation with locking caps, wound closure, dressing.
Postoperative management: 
Pain-related mobilization, physiotherapy, indication for anterior fusion to be considered.
Results: 
In 2012, 80 patients (42 female, 38 male) with a mean age of 59.7 years received posterior stabilization (27 open, 53 percutaneous). Intraoperative radiation was significantly higher in the percutaneous group compared with the open group (percutaneous: 212 s; open: 146 s; p < 0.05), while the length of surgical treatment was significantly shorter (percutaneous: 107 min; open: 143 min; p < 0.05). Accuracy of screw positioning and the amount of reduction was similar in both groups. Major complications did not occur."," RAYYAN-INCLUSION: {""Pavel""=>true, ""dursunov.eldar97""=>true, ""lumena27""=>true}"
26983411,Effect of the percutaneous pedicle screw fixation at the fractured vertebra on the treatment of thoracolumbar fractures.,2016,6,1,International orthopaedics,1432-5195,40,6,1103-10,"Li, Kunpeng and Li, Zhong and Ren, Xiaofeng and Xu, Hui and Zhang, Wen and Luo, Dawei and Ma, Jinzhu",https://www.ncbi.nlm.nih.gov/pubmed/26983411,eng,,,"Purpose: 
The purpose of this study was to evaluate the efficacy and safety of percutaneous pedicle screw fixation at the fractured vertebra in the treatment of thoracolumbar fractures.
Methods: 
Thirty-two consecutive patients were enrolled in the study. All patients received percutaneous pedicle screw fixation, and they were randomly divided into two groups to undergo either the placement of pedicle screws into the fractured vertebra (fractured group) or not (control group). The operation time and intra-operative blood loss were recorded. Oswestry disability index (ODI) questionnaire and visual analogue scale (VAS) as clinical assessments were quantified. Radiographic follow-up was defined by the vertebral body index (VBI), anterior vertebral body height (AVBH), and Cobb angle (CA).
Results: 
No significant difference was observed in the operation time and intra-operative blood loss between the two groups. Clinical results (VAS and ODI scores) showed no significant difference during all the follow-up periods. In the fractured group, there were better correction and less loss of AVBH and VBI compared with the control group. However, post-operative correction of the CA immediately after surgery and the correction loss at the final follow-up showed no significant difference between the two groups.
Conclusion: 
Percutaneous screw fixation combined with intermediate screws at the fractured vertebra could more effectively restore and maintain fractured vertebral height, and is an acceptable, minimally invasive surgical choice for patients with type A thoracolumbar fractures."," RAYYAN-INCLUSION: {""Pavel""=>true, ""dursunov.eldar97""=>true, ""lumena27""=>true}"
26907876,A comparison of three different surgical procedures in the treatment of type A thoracolumbar fractures: a randomized controlled trial.,2016,6,1,International orthopaedics,1432-5195,40,6,1233-8,"Lyu, Jianhua and Chen, Kai and Tang, Zhaohui and Chen, Yu and Li, Ming and Zhang, Qiulin",https://www.ncbi.nlm.nih.gov/pubmed/26907876,eng,,,"Purpose: 
The aim of the study was to evaluate the efficacy of three different surgical procedures in the treatment of type A thoracolumbar fractures.
Materials and methods: 
Between September 2012 and January 2015, a total of 90 patients with type A thoracolumbar fractures were randomly assigned into three groups of 30 each. Patients in group A, B, and C were treated with three-level percutaneous fixation, two-level percutaneous fixation, and three-level open fixation, respectively. Blood loss, duration of surgery, VAS scores, Cobb angles, and anterior height ratios of fractured vertebrae were collected for statistical analysis.
Results: 
The average follow-up was 17.7 months. Post-operative Cobb angles were significantly corrected and anterior height ratios of fractured vertebrae were well restored in all three groups (p < 0.01). Back pain was efficiently relieved according to VAS score change (p < 0.01). There were significant differences in values of blood loss and post-operative VAS scores (at three months) between group A and group C (p < 0.01). No significant difference concerning post-operative anterior height ratios of fractured vertebrae, Cobb angles and correction losses was observed between group A and group B (p = 0.580, 0.840, 0.215, respectively).
Conclusion: 
Percutaneous fixation not only provides the same reduction effect as open fixation, but also has an advantage of causing less operation related trauma which is beneficial to post-operative rehabilitation. The efficacy of three-level percutaneous fixation and two-level percutaneous fixation in the treatment of type A thoracolumbar fractures is not significantly different."," RAYYAN-INCLUSION: {""Pavel""=>true, ""dursunov.eldar97""=>true, ""lumena27""=>true}"
22489522,[Single-segment pedicle screw fixation for the treatment of thoracolumbar fractures through the gap of paravertebral muscles].,2012,1,1,Zhongguo gu shang = China journal of orthopaedics and traumatology,1003-0034,25,1,Jun 42,"Wang, Ren-Yan and Hua, Yong-Jun and Chen, Jin-Hong and Chai, Jun-Lei and Shao, Li-Fang and Zhao, Jian-Feng",https://www.ncbi.nlm.nih.gov/pubmed/22489522,chi,,,"Objective: 
To compare the clinical effect of thoracolumbar fractures between single-segment pedicle screw fixation approach for the gap of paravertebral muscles and double-segment pedicle screw fixation approach for the stripping of paravertebral muscles.
Methods: 
From September 2008 to January 2010, 65 patients with incomplete compressed thoracolumbar fractures or burst thoracolumbar fractures with unilateral endplate injury were randomly divided into two groups. Thirty patients were treated with single-segment pedicle screw fixation through the gap of paravertebral muscles (treatment group). Thirty-five patients were treated with double-segment pedicle screw fixation through the stripping of the paravertebral muscles (control group). All the internal fixations were taken out during 10-12 months after operation. Operative time, perioperative blood loss volume and postoperative drainage volume were compared between two groups. At final follow-up, the change of neurological ASIA grade were recorded; and postoperative 5 days and final follow-up, compared Denis classification of lumbar and back pain between two groups; and analyzed the sagittal index and compressibility of anterior border of vertebral body by X -ray lateral projection.
Results: 
All patients were follow-up from 14 to 22 months with an average of 18.3 months. No postoperative infection, secondary spinal cord injury was found. One case of control group occurred internal fixation breakage at the 11th month after operation and other internal fixation no loosening. There was no significant difference in operative time, the recovery of neurological function between the two groups (P > 0.05). Perioperative blood loss volume and postoperative drainage volume of treatment group was less than that of control group (P < 0.01). And in Denis classification of lumbar and back pain, the treatment group recovered more quickly, and the residual pain of lumbar and back was less than that of control group (P < 0.01). Postoperative posterior salient and compression of anterior border of vertebral body improved in two groups (P < 0.01), there was no significant difference in degree of improvement between two groups (P > 0.05); but both loss existed at final follow-up (P < 0.01), there was no significant difference in loss of posterior salient between two groups (P > 0.05). In the treatment group, the loss of rectify of anterior border of vertebral body existed, but it was less than that of the control group.
Conclusion: 
In the premise of strict controlling surgery indications, the treatment of thoracolumbar fractures with single-segment pedicle screw fixation through the gap of paraspinal muscles, can effectively recover the height of vertebral body and rectify posterior salient, and reduce the fixed segment. Compared with the traditional operative method of double-segment pedicle screw fixation through the stripping of paraspinal muscle, it can obviously reduce the operation wound and the bleeding, lessen the pain of lumbar and back. And the recent clinical effect is satisfied."," RAYYAN-INCLUSION: {""Pavel""=>true, ""dursunov.eldar97""=>true, ""lumena27""=>true}"
24563980,Treatment of thoracolumbar burst fractures: short-segment pedicle instrumentation versus kyphoplasty.,2013,1,1,Acta orthopaedica Belgica,0001-6462,79,6,718-25,"Zhang, Lei and Zou, Jun and Gan, Minfeng and Shi, Jinhui and Li, Jigang and Yang, Huilin",https://www.ncbi.nlm.nih.gov/pubmed/24563980,eng,,,"Unlabelled: 
The management of amyelic thoracolumbar burst fractures remains controversial. In this study, we compared the clinical efficacy of percutaneous kyphoplasty (PKP) and short-segment pedicle instrumentation (SSPI). Twenty-three patients were treated with PKP, and 25 patients with SSPI. They all presented with Type A3 amyelic thoracolumbar fractures. Clinical outcomes were evaluated by a Visual Analog Scale (VAS) and Oswestry Disability Index (ODI) preoperatively, postoperatively, and at two years follow-up. Radiographic data including the anterior and posterior vertebral body height, kyphotic angle, as well as spinal canal compromise was also evaluated. The patients in both groups were similar regarding age, bone mineral density (BMD), follow-up period, severity of the deformity and fracture. Blood loss, operation time, and bed-rest time were less in the PKP group. VAS, ODI score improved more rapidly after surgery in the PKP group. No significant difference was found in VAS and ODI scores between the two groups at final follow-up (p > 0.05). Meanwhile, the height of anterior vertebrae (Ha), the height of posterior vertebrae (Hp) and the kyphosis angle showed significant improvement in each group (p < 0.05). The postoperative improvement in spinal canal compromise was not statistically significant in the PKP group (p > 0.05); there was a significant improvement in the SSPI group (p < 0.05). Moreover, these postoperative radiographic assessments showed significant differences between the two groups regarding the improvement of canal compromise (p < 0.05). At final follow-up, remodeling of spinal canal compromise was detected in both groups.
Conclusion: 
Both PKP and SSPI appeared as effective and reliable operative techniques for selected amyelic thoracolumbar fractures in the short-term. PKP had a significantly smaller blood loss and shorter bed-rest time, but SSPI provided a better reduction. Long-time studies should be conducted to support these clinical outcomes."," RAYYAN-INCLUSION: {""Pavel""=>true, ""dursunov.eldar97""=>true, ""lumena27""=>true}"
29113901,Efficacy of Using Intermediate Screws in Short-Segment Fixation for Thoracolumbar Fractures: A Meta-Analysis of Randomized Controlled Trials.,2018,1,1,World neurosurgery,1878-8750,110,,e271-e280,"Tong, Min-Ji and Tang, Qian and Wang, Cheng-Gui and Xiang, Guang-Heng and Chen, Qi and Xu, Hua-Zi and Tian, Nai-Feng",https://www.ncbi.nlm.nih.gov/pubmed/29113901,eng,,,"Background: 
Some studies have reported that the conventional intersegmental pedicle screws (4-screw fixation [4S]) device for thoracolumbar fractures was associated with inadequate reduction of fractured vertebrae, insufficient correction of kyphosis, and implant failure. Recently, a series of biomechanical studies has confirmed that the addition of intermediate fixation screws (6-screw fixation [6S]) could provide stronger fixation and better reduction of fractured vertebrae. Nevertheless, the clinical and radiologic efficacy of the additional intermediate screws remains unclear.
Methods: 
A meta-analysis of randomized controlled trials was used to compare clinical and radiologic outcomes and complications of posterior pedicle screws combined with intermediate screws fixation versus conventional intersegmental pedicle screw fixation. We comprehensively searched MEDLINE, OVID, and Springer according to a search strategy, selecting articles based on inclusion criteria, and extracted data from these reports. Risk of bias in included studies was assessed. Pooled estimates and corresponding 95% confidence intervals were calculated.
Results: 
Six randomized controlled trials involving 310 patients were evaluated in this meta-analysis. Pooled estimates showed statistically similar baseline characteristics, hospital stays, postoperative visual analog scale scores, and infection rates between the 4S group and the 6S group. The 6S group had significantly less correction loss of segmental angle and of anterior vertebral height compression, and lower implant failure rate. The 6S group also showed a slightly longer operative time and more blood loss than did the 4S group.
Conclusions: 
Based on our analysis, the combined intermediate screws fixation technique was associated with significantly improved radiologic outcomes but did not seem to compromise other perioperative outcomes."," RAYYAN-INCLUSION: {""Pavel""=>true, ""dursunov.eldar97""=>true, ""lumena27""=>true}"
28803178,Treatment of Unstable Thoracolumbar Fractures: Does Fracture-Level Fixation Accelerate the Bone Healing?,2017,1,1,World neurosurgery,1878-8750,107,,362-370,"Özbek, Zühtü and Özkara, Emre and Önner, Hasan and Baş, Gültekin and Erman, İpek Canan and Özen, Hülya and Entok, Emre and Arslantaş, Ali",https://www.ncbi.nlm.nih.gov/pubmed/28803178,eng,,,"Objective: 
To investigate the effect of fusion on short segment including fractured level (SSIFL) and long segment (LS) transpedicular fixation after acute thoracolumbar junction burst fractures. The 2-year clinical and radiologic follow-up results of the 2 groups also were compared.
Methods: 
Seventy-four patients were randomized into one of 2 groups: SSIFL (n = 39) or LS (n = 35). The SSIFL group included one level above and one level below, including the fracture level, whereas the LS group included 2 levels above and 2 levels below, excluding the fracture level, for the transpedicular fixation. Fusion was assessed by technetium 99m-methylendiphosphonate, bone scintigraphy, and single-photon emission computed tomography. The 2-year follow-up results were compared clinically (Oswestry Disability Index and visual analog scale) and radiologically (kyphosis angle, sagittal index, anterior vertebral body height loss) at regular intervals. The clinical scores and radiologic parameters of patients with and without fusion also were compared.
Results: 
The number of patients with fusion was significantly greater in the SSIFL group compared with the LS group. There was a significant reduction of the clinical scores of patients who had fusion compared with the fusion-free group; however, there was no radiologically significant difference. Furthermore, there was no significant difference between the SSIFL and LS groups in terms of the 2-year radiologic and clinical follow-up results.
Conclusions: 
Fusion occurred sooner and patients experienced earlier clinical recovery in the SSIFL group compared with the LS group."," RAYYAN-INCLUSION: {""Pavel""=>true, ""dursunov.eldar97""=>true, ""lumena27""=>true}"
28777064,Is fusion necessary for thoracolumbar burst fracture treated with spinal fixation? A systematic review and meta-analysis.,2017,1,1,Journal of neurosurgery. Spine,1547-5646,27,5,584-592,"Diniz, Juliete M and Botelho, Ricardo V",https://www.ncbi.nlm.nih.gov/pubmed/28777064,eng,,,"OBJECTIVE Thoracolumbar fractures account for 90% of spinal fractures, with the burst subtype corresponding to 20% of this total. Controversy regarding the best treatment for this condition remains. The traditional surgical approach, when indicated, involves spinal fixation and arthrodesis. Newer studies have brought the need for fusion associated with internal fixation into question. Not performing arthrodesis could reduce surgical time and intraoperative bleeding without affecting clinical and radiological outcomes. With this study, the authors aimed to assess the effect of fusion, adjuvant to internal fixation, on surgically treated thoracolumbar burst fractures. METHODS A search of the Medline and Cochrane Central Register of Controlled Trials databases was performed to identify randomized trials that compared the use and nonuse of arthrodesis in association with internal fixation for the treatment of thoracolumbar burst fractures. The search encompassed all data in these databases up to February 28, 2016. RESULTS Five randomized/quasi-randomized trials, which involved a total of 220 patients and an average follow-up time of 69.1 months, were included in this review. No significant difference between groups in the final scores of the visual analog pain scale or Low Back Outcome Scale was detected. Surgical time and blood loss were significantly lower in the group of patients who did not undergo fusion (p < 0.05). Among the evaluated radiological outcomes, greater mobility in the affected segment was found in the group of those who did not undergo fusion. No significant difference between groups in the degree of kyphosis correction, loss of kyphosis correction, or final angle of kyphosis was observed. CONCLUSIONS The data reviewed in this study suggest that the use of arthrodesis did not improve clinical outcomes, but it was associated with increased surgical time and higher intraoperative bleeding and did not promote significant improvement in radiological parameters."," RAYYAN-INCLUSION: {""Pavel""=>true, ""dursunov.eldar97""=>true, ""lumena27""=>true}"
28641907,Is fusion superior to non-fusion for the treatment of thoracolumbar burst fracture? A systematic review and meta-analysis.,2017,1,1,Journal of orthopaedic science : official journal of the Japanese Orthopaedic Association,0949-2658,22,5,828-833,"Lan, Tao and Chen, Yang and Hu, Shi-Yu and Li, Ao-Lin and Yang, Xin-Jian",https://www.ncbi.nlm.nih.gov/pubmed/28641907,eng,,,"Objective: 
The purpose of this meta-analysis was to compare the efficacy and safety between patients with thoracolumbar burst fracture who underwent posterior fixation alone (non-fusion) and supplemented with fusion.
Methods: 
A comprehensive search of related literature was performed in PubMed, Embase and the Cochrane library. Clinical outcomes (LBOS and VAS), surgical outcomes (operation time, blood loss, hospital stay and perioperative complications), and radiographic outcomes (kyphotic angle, decreased vertebral body height and segmental motion) were assessed in the meta-analysis. Data analysis was conducted with RevMan 5.3 software.
Results: 
Five RCTs and three retrospective studies including a total of 445 cases were identified. We found that there was no significant difference in terms of LBOS, VAS, implant-related complications, kyphotic and VBH parameters. However, there was a significant difference regarding blood loss, operation time, segmental motion and donor site pain between fusion and non-fusion.
Conclusion: 
This meta-analysis demonstrated that posterior fixation alone could achieve satisfactory clinical and radiological results in treating thoracolumbar burst fracture. Moreover, posterior fixation without fusion was superior to additional fusion with less blood loss, shorter operation time, better segmental motion and lower donor site pain."," RAYYAN-INCLUSION: {""Pavel""=>true, ""dursunov.eldar97""=>true, ""lumena27""=>true}"
28343026,Comparison of unilateral versus bilateral pedicle screw fixation at the level of fracture using posterior short-segment pedicle instrumentation in the treatment of severe thoracolumbar burst fractures.,2017,1,1,"International journal of surgery (London, England)",1743-9159,41,,50-55,"Sun, Chao and Liu, Xinhui and Tian, Jiwei and Guan, Guoping and Zhang, Hailong",https://www.ncbi.nlm.nih.gov/pubmed/28343026,eng,,,"Background: 
Thoracolumbar burst fractures (TBFs) are often followed by bilateral pedicle screw fixation (BPSF) at the level of fracture using posterior short-segment pedicle instrumentation (SSPI). There has been increasing support for unilateral pedicle screw fixation (UPSF) in an attempt to reduce complications and costs. The aim of this study was to compare the clinical and radiologic results of UPSF versus BPSF at the level of fracture using SSPI in the treatment of severe TBFs.
Methods: 
The records of 42 consecutive patients with severe TBFs who underwent SSPI were divided into 2 groups according to the number of screws in the fracture level, including 20 patients (five screws) in UPSF group and 22 patients (six screws) in BPSF. Different clinical and radiological parameters were recorded before surgery, after surgery, and 1.5 years after operation. The patients'clinical outcomes were assessed using visual analog scale (VAS), and Oswestry Disability Index (ODI). For radiological evaluation, changes in local kyphosis angle (LKA), vertebral wedge angle (VWA), and anterior vertebral height (AVH) were investigated using plain radiographs.
Results: 
Mean follow-up was 18.3 months for UPSF group and 19.0 months for BPSF group (P > 0.05). There were no significant differences in the age, gender, fracture type and site in both groups. Radiologically, no statistically difference was observed between the two groups in corrected rate of LKA, VWA, or AVH(all P > 0.05). With respect to clinical variants including VAS and ODI scores, there were also no significant differences. However, the UPSF group seemed to have advantages over BPSF group in operative time, blood loss, postoperative drainage, hospitalization time (P > 0.05). Especially, implant cost for the BPSF group was 22% greater than the UPSF group. No serious complications occurred in our study. In all cases, fusions healed well and no revision surgery was performed for loss of correction or failure of instrumentation during follow-up.
Conclusions: 
The present study is the first to demonstrate that patients undergoing SSPI with UPSF as compared with BPSF for the treatment of severe TBFs had similar clinical and radiologic outcomes."," RAYYAN-INCLUSION: {""Pavel""=>true, ""dursunov.eldar97""=>true, ""lumena27""=>true} | RAYYAN-LABELS: РИ?"
